teams playing basketball on a court in a stadium .,0
boy playing basketball , trying to block a shot .,5
basketball player in a white uniform jumps up to block another player in a blue uniform with the ball .,5
boys play basketball .,0
opposing basketball players are making a play with an audience nearby .,5
young flag football team are huddled together .,5
asian man in a black tracksuit is watching students doing exercised on basketball court .,0
people on a basketball court .,0
girl defends the basketball from another player .,5
girl playing basketball attempts a shot while another girl aggresively defends her .,0
participating in a basketball game in front of a crowd .,5
opposing basketball player is making a hook shot over the defender .,5
person in a baseball cap and jeans resting on a brown couch .,0
group of asian women in sports attire , and one woman in the center is wearing a baseball cap .,0
are several asian people , one wearing a baseball cap .,0
baby in a baseball shirt crawls through a tube .,0
basketball player looks upward as a hand reaches for her ball .,5
female basketball player wearing a red uniform is holding a basketball and looking up while an arm is trying to block her .,5
female woman has a basketball in her hands and a determined look on her face .,0
woman basketball player holding the ball grimaces with effort while another player 's arm attempts to block her .,0
woman with a red basketball jersey is holding a basketball and looking up .,0
baseball player is on the field in fronmt of an audience .,5
man is playing with a foam football on the beach .,5
basketball team of 8 girls is doing a hand huddle .,0
group of basketball players in a huddle .,0
players huddle .,0
group of men in camouflage pants , break dancing on a stage at a community baseball field .,5
bald man is attempting to slam dunk a basketball in a game while people in the stands watch .,5
basketball player is jumping and about to dunk a ball in front of a crowd .,0
man reaches toward dunking a basketball while an audience watches .,5
tattooed man dunks a basketball .,5
tattooed basketball player is about to dunk the ball .,5
black and white dog catching a baseball in midair .,0
skinny white dogs with two standing men in baseball caps,0
man in a rugby uniform is grabbing the arm of another man holding a football .,0
men on a playing field , one of them holding a football .,0
boy in a baseball uniform runs the bases .,5
boy is running around the bases in a baseball game .,5
boy runs to a baseball base .,0
child in a baseball uniform runs on a baseball field .,5
young baseball player is running to one of the bases .,5
baseball player throws the ball .,0
boy in the middle of a pitch at a baseball game .,0
pitcher on a mound throws a baseball .,0
teenage boy pitching a baseball .,0
young pitcher is throwing the baseball .,0
participate in a baseball game .,0
baseball players in motion ; one sliding into a base , another running in the background .,0
men playing baseball and the one wearing a red helmet is sliding to the plate .,0
baseball player crouching to catch the ball as a runner slides to safety .,5
boy is sliding towards a base while the baseman is waiting for the ball in a baseball game .,0
Children playing baseball at the park .,0
football player in possession of the ball gets tackled by a football player on the opposing team .,0
football player leaps in the air while another tries to hold onto his foot .,0
football player in orange and white uniform dodges tackle of another player .,0
guys playing football .,0
men during a football game,0
child wearing black and purple playing baseball .,5
catcher in a black uniform on the ground with his glove upraised during a baseball game , while a man UN a white uniform keeps a foot on the base .,0
baseball player is trying to run to a base while the baseman catches the ball .,0
people play baseball on a field at a park .,0
dogs play with purple football .,0
group of basketball players stand on the basketball court .,0
group of men play basketball .,0
play basketball on a wood floor near clear glass doors .,5
men around an indoor basketball hoop .,5
boys playing indoor basketball , one team has black and white uniforms , the other has orange and white .,5
basketball player attempts a layup in a gymnasium .,5
guy is going up for a lay-up on a basketball court .,5
group of men stand in a gymnasium with a basketball .,5
group of young men in a gym take turns scoring in basketball .,0
line of basketball players doing a drill .,5
boys on basketball court .,0
young men playing basketball,0
football player in blue grabs a football player in white for a tackle .,0
football player is being tackled by the rival team .,0
football player is tackling the player with the football as the crowd watches .,5
players on a feild the one on the left in a blue uniform the one on the right in a white one with the fans in the back .,0
football player from the opposite team are holding back the one with the ball .,0
female baseball players reach for the ball .,0
baseball player slides home in a non professional baseball game in an HDR photograph .,0
baseball player in white swings for the ball as the player in brown is waiting to intercept .,5
baseball player punting .,0
baseball player swings at the ball as onlookers watch .,0
baseball player attempts to catch a ball while another runs towards the base .,5
baseball player catches the ball while the batter reaches the base .,0
umpire in a baseball game crouches to catch a ball while an opposing team member runs to homebase .,5
children are playing baseball,5
baseball player is making a play nearby a large sign and boundary of the field .,5
girl catches a baseball .,0
baseball player in a black shirt just tagged a player in a white shirt .,0
woman in a baseball uniform tags another with her mitt .,0
baseball player hitting the ball,0
teenager dressed in a baseball uniform attempting to hit a baseball during a game .,5
baseball player in a red shirt and white pants is swinging the bat towards a yellow ball whilst three people look on .,5
baseball player recoils from an action involving a bat while opposing team members look on .,5
person leans forward to catch a baseball while a runner comes close to the base .,0
girl in a baseball uniform getting ready to throw the ball at a game .,5
female wearing a baseball uniform swinging a bat .,0
woman in a brown strip is taking a swing with a baseball bat at a yellow ball , whilst another woman is waiting on the sideline .,0
boy hits the ball at a baseball game .,0
hits a baseball,0
of the members of a baseball team in brown and white is at bat .,5
baseball player holds his bat and gets ready for the game .,0
boy is getting ready to play baseball .,5
boy plays baseball .,0
person in a blue and white baseball uniform is standing on one foot while holding a bat .,0
player holding a bat .,0
girl in a yellow shirt is throwing a wet football .,0
man in a baseball cap does a skateboard jump on a half pipe .,0
guy jumps to make a basketball shot .,5
men playing basketball on a court with various people in the background .,0
man drives the lane for a shot in the outdoor basketball game .,0
three men are playing basketball on a blacktop .,0
men are playing basketball and one of them blocked the others shot while people play in the back .,5
baseball player trows the ball .,5
player throwing the baseball .,0
man is pitching a baseball on a dirt mound .,0
baseball pitcher in a red and white uniform throws the ball while his teammate watches .,0
baseball pitcher on the mound leaning into his pitch .,0
pitcher throwing a ball at a baseball game,0
is being played by two men in red jerseys by a " pepco " sign .,0
group of boys play basketball together .,5
player makes a shot as other players to try to intercept .,5
teenagers are scrambling for a basketball underneath the net .,0
people are playing basketball outdoors .,0
men playing basketball under a blue sky,5
white dog , two black dogs , and a black and white dog are playing on the edge of a baseball field .,0
dogs are playing at the baseball field .,0
dogs are running on the grass , near a baseball field .,0
dogs run and play on the baseball field .,0
people are kicking a soccer ball in a basketball court .,5
boy holds the bat waiting for the pitch at a baseball game .,0
little boy batting in a baseball game .,0
young boy in a blue and white uniform is up to bat at a baseball game .,0
plays baseball .,0
wearing a blue , white , and yellow baseball uniform about to hit a ball .,0
young boy in a baseball cap jumps into the arms of a man wearing a blue shirt .,0
boy dunks a basketball .,0
boy dunks a basketball on a low hoop by the road .,5
boy jumps up to make a basket in a basketball hoop .,5
boy with a basketball , leaping for the goal .,0
teenage boy is dunking a basketball in a hoop .,5
man wearing a baseball cap leaning against a post .,0
baseball pitcher with Shelton on his shirt throws the ball .,0
baseball player in a black and orange shirt , and with a glove on , pitches the ball .,0
male dressed in a sports outfit tries to catch a baseball .,0
man playing baseball .,0
baseball player is running after the ball .,0
plays baseball in a grass field .,0
brown dog with a baseball in its mouth .,0
dog holding a baseball in his mouth .,0
dog with a baseball in his mouth .,0
man in a pink shirt is standing in a basketball court holding a basketball .,5
young adult male stands with a basketball on a court .,5
holding a basketball wearing red shirt black shorts with something on left leg,5
man in red and black stands outside holding basketball .,0
man with the red shirt is holding a basketball and is in front of a basketball hoop .,5
baseball player just taking a swing at a stadium .,5
baseball player swings the bat as a catcher and umpire watch .,5
batsman is about to swing for a baseball whilst the catcher and referee wait behind him .,0
ump in black watches a baseball game .,5
baseball player takes a swing .,0
little girl about to hit a baseball off a tee,0
little girl is swinging at a baseball .,5
boys on a black top with a green and yellow basketball .,5
baseball is being thrown at a volleyball net .,0
boy whose head has been replaced by a baseball .,5
Child hits a baseball into a net .,0
child is throwing a baseball into a net .,5
young boy with a baseball obscuring his face through a net .,0
play baseball .,0
playing baseball .,0
baseball player is catching a ball on the field .,0
is a baseball player in a yellow shirt running midfield .,0
guys playing baseball .,0
young baseball player sliding into a base while a dust cloud rises and the other team moves around him .,0
playing baseball , cars parked in the background .,5
little boys are playing baseball .,0
few young boys throwing a football over a volleyball net .,0
are throwing a football on the beach .,5
children are playing a game , with a volleyball net and a football , on the beach .,5
boys play with a football near a volleyball net at the beach .,5
baseball pitcher wearing a white and red uniform caught in midpitch of the ball .,0
baseball player in white uniform throwing baseball,0
profession baseball player pitches a ball in a baseball game .,0
man in the white and red uniform gets ready to throw the baseball .,0
is a man pitching a baseball and has a glove his left hand .,0
Boston baseball player at bat,0
Boston Red Sox baseball player holds the bat waiting for the incoming pitch .,0
man is playing baseball .,0
batter ready to hit the ball,0
baseball player slides to the base .,0
person playing baseball slides for home .,0
baseball players on a field , with four spectators , and a crowd .,0
men on opposite baseball teams dive for a baseball at homebase .,5
man is leaping off of the pool deck to catch a football .,0
baseball player dodges a ball with his bat high in the air .,0
baseball player in a white uniform is walking to base while a crowd of people watch from the bleachers .,0
baseball player near home plate .,0
baseball player raises the bat above his head .,0
baseball player runs to catch the ball .,0
young boy holds his head to a baseball bat on the green grass .,0
young boy is spinning around a baseball bat on the grass .,0
boy puts his forehead on the baseball bat and spins around to make himself dizzy .,0
little boy is wearing red shorts and a white t-shirt and has his head resting on a baseball bat .,5
boy pitches in a baseball game .,0
young baseball player winds up to throw the ball .,5
young person pitches in a baseball game .,0
baseball player is throwing the ball .,0
girls with baseball caps are eating a snack outside .,5
black and white dog stands on the grass with a baseball in his mouth,0
closeup of a small black and white dog with a baseball in its mouth .,0
and white dog holding a baseball in mouth .,0
and white dog with baseball in mouth , field and building .,0
and white dog with a baseball in its mouth .,0
dog is wearing a red baseball cap , and has its mouth wide open .,0
young boy is getting ready to hit a pinata with a blue baseball bat .,5
brown dog dives backwards to catch the football .,0
man with a bushy beard and a baseball cap sits on a park bench .,0
spotted dog playing on a baseball field with another dog .,5
dogs play on a baseball field .,0
watching a guy in a black and green baseball cap skateboarding .,5
opposing footballers play on a field .,0
playing tag football run down the field .,0
kid is chasing another kid who is holding a football .,0
kid is running across a field carrying a football while another is close behind grabbing for his flags .,0
children playing tag football .,5
little boys play football on green grass .,0
boy holding a toy football , runs along a paved path .,5
boy runs past a house carrying a very small plastic foam football .,0
boy runs with a very small football down a paved walkway .,5
person runs with a small football .,0
young boy running on a sidewalk holding a small football .,0
man holds a sign offering to trade a poem for a football ticket .,0
woman in yellow is throwing the football to the woman in brown .,5
girls throwing a football in their backyard .,5
guy and a girl wearing baseball caps and black scarves around their necks .,5
child hits a baseball .,5
little boy hits a baseball while his family watches,5
man wearing red shorts dribbles a basketball behind him .,0
man with no shirt plays basketball .,0
athlete in red shorts is caught frozen during a basketball move .,0
shirtless man in red shorts bouncing a basketball on a court .,0
in red shorts bouncing a basketball .,0
with baseball gloves walking across a baseball field,0
woman playing baseball walks back to her base while her feamle teammate follows .,0
woman with a glove on a baseball field with another woman,5
boy in a red baseball cap eats a Ritz cracker and has a big pink cup of juice,0
wet brown dog is jumping into the air to try and catch a basketball with his mouth .,0
wet brown dog jumps up to get a white basketball .,0
wet dog leaped toward the basketball .,0
little boy in an orange collared shirt is swinging a baseball bat .,0
man with a baseball cap and shiny sunglasses looks down while another bald man looks down .,5
man wearing a backwards baseball cap .,0
man wearing a blue baseball cap is gazing into the distance .,5
man with a beard and a navy blue backwards baseball cap stares intently at something in the distance .,0
person with blue hair , a baseball cap , and a hood on stands outdoors in a crowd .,0
baseball player standing on the field,0
baseball player stands and faces the crowd .,0
baseball player wearing a number 19 shirt looks at the outfield .,5
player looking out into a stadium crowd,0
