child in a pink dress is climbing up a set of stairs in an entry way .,0
child practices hitting a baseball into a net , while two adult men watch .,5
man is holding the net for the boy playing baseball .,0
boys baseball team wear their uniforms .,5
boys are all wearing the same baseball hats .,5
boy in blue with a football sprawls in the grass .,0
boy laying on the grass face down with a football at his feet .,0
is lying face down in the grass with his foot on a football .,0
boy is on the ground next to the football .,0
little boy fell face first into the grass while playing football .,5
boy in white plays baseball .,0
young boy is getting ready to through a baseball,5
boy is wearing a white baseball uniform and holding a baseball .,0
young Ohio baseball player contemplates his pitch .,0
man tries to catch a football on grass surrounded by American flags .,5
boy hits a baseball with the bat .,0
boy swings a baseball bat , and a catcher stands behind him .,5
kid hits a baseball during a game .,0
little boy in a teal uniform swinging a baseball bat .,0
boy in the blue shirt is swinging a baseball bat towards a ball as the boy in the red helmet waits to catch him out .,0
little boy points to the face of another little boy in base in a baseball game .,5
young baseball player is pointing a finger in the face of a player on the other team .,5
boys on oppsite sides of the baseball teams arguing with each other at a base .,5
man dressed in a white shirt , blue baseball cap while wearing gloves , holding a red and white checkered food wrapping .,5
older man in a baseball cap,0
Baseball batter raising his arm .,0
baseball player from New York waiting to bat during a game .,0
baseball player in a Yankees uniform is holding a bat in one hand,0
woman in a dress and baseball cap sits next to the water .,0
girl in the blue dress and the baseball cap is sitting near the ocean .,5
young boy and girl playing baseball in a grassy field .,0
football player pauses during a game .,0
football player wears a green jersey with the number " 4 " on it .,5
football player is being handed a towel on the field .,5
takes a cloth off of a Green Bay Packers football player .,0
boy holds a basketball angerly .,0
boy with a basketballs glowers at the camera .,0
young boy shows off his basketball skills,5
boy is holding a basketball on a wooden basketball court .,0
are two boys on a basketball court and one is holding a basketball .,0
boy dribbles a basketball in the gymnasium .,0
boy dribbling a basketball in a gym .,0
boy wearing a Steve Nash shirt dribbles a basketball on an indoor court .,0
child in a gray t-shirt is bouncing a basketball on a basketball court .,5
little boy dribbles his basketball .,0
group of boys play flag football while some bystanders watch .,0
playing tag football .,0
boys playing flag football in blue and white uniforms,5
boys play touch football .,0
baseball is recoiling from an action taken on a treated field watched by others .,0
baseball player on a playing field springs into action .,5
baseball player standing on the mound .,0
pitcher in a red and white uniform in a baseball game has just thrown the ball .,0
are scrambling around the goal as the goal keeper reaches for the ball .,5
white haired man in the black baseball cap is wearing a black jacket covered with car racing emblems .,0
boy standing and watching a group of people on a basketball court .,0
boy takes a football from another boy .,0
the ground a boy in a red sweatshirt is leaning over holding a football and two other kids .,0
boys are playing football in the grass .,0
boys play football in the grass .,0
kids are resting after playing football,0
dog is playing with a football in the snow .,0
young girl in a green shirt playing basketball .,5
young basketball player moves into the front court .,5
play basketball on a court .,0
young boys play basketball .,0
children are playing a basketball game on a basketball court .,5
small boys play basketball indoors .,5
small boys playing basketball .,0
elderly woman in burgundy scratches her face as she observes a young man in a blue jacket and white baseball cap .,0
boy playing basketball in a gym,0
young boy holding a basketball about to shoot .,0
young boy , playing basketball , is getting ready to take a shot .,5
boy in the white jersey is dribbling the orange Wizards basketball .,0
child holds a football and runs from other children .,5
young boy in a blue uniform running with a football while playing a game of flag football .,5
young boy weating blue shorts and cleats holding a football running from other boys .,5
young male carrying a football and running while two other boys run behind him .,0
man with a baseball cap on backwards is holding a cup,0
boy with red shorts is holding a basketball in a basketball court .,0
young boy is playing basketball in an official game .,0
boy is playing basketball .,0
boy runs with the basketball while looking up .,5
children are playing basketball indoors .,5
boy holds a basketball during a game , while others watch .,5
boy is holding a basketball in one hand .,0
boy is running with a basketball in his hands .,0
boy throws a basketball during a game .,0
young boy plays basketball while a few people behind him look on .,0
basketball player in a duke uniform looks up .,0
are three basketball players,0
men in basketball uniforms looking at something .,5
basketball players from duke are looking upward .,5
basketball players watching the ball .,0
boy in a black shirt is grabbing the flag of the boy in the red shirt with the football .,5
boys are playing flag football .,5
boys playing a game of flag football .,0
boys with mouthguards and one is holding a football while the other reaches for him .,0
football players with mouthguards .,0
young boy on a basketball team dribbles the ball .,0
young boy playing basketball in a gym , wearing a uniform .,0
boy in the royal blue basketball uniform is dribbling the ball down court .,5
boy runs across the court with the basketballs .,0
young boy is running while bouncing a basketball .,0
kid in a yellow jacket and blue baseball cap jumping from a rock .,0
dog tries to play with a basketball in the snow .,5
man wearing a black shirt and baseball cap smiling .,0
young boy singing at a large baseball off of a tee .,5
young boy swings a bat at a large baseball .,0
little boy is wearing a blue shirt and playing baseball .,0
boy plays basketball .,0
boy wearing blue shorts is bouncing a basketball in front of the net .,0
little boy plays with a basketball and a toy basketball hoop .,5
boy playing basketball in the grass,0
child in the blue shorts dribbled the basketball .,5
football game .,0
Oklahoma football player standing,0
play just beginning during a football game .,5
players playing a football game .,0
football player number 50 plays in a game .,5
football player dodges a tackle from his opponent .,0
football player in red chases a football player in blue .,5
football player in red is trying to tackle another player who has the ball .,0
football player wears a jersey wuth the number " 4 " on it .,5
football player in the gold helmet is running .,0
discouraged looking football coach .,5
football coach holds a headset .,0
man runs on the football field carrying the ball in front of the ref .,0
man runs with the football at a professional or collegiate game .,5
American footballer in a white and purple strip is making a run with the ball .,5
UW football player runs with the ball .,0
football player runs with the ball across the field .,0
football coach watches a play being made .,5
crowd wearing red , cheers on the red football team .,0
players in red congratulate each other as crowds in red cheer behind .,0
Oklahoma Sooners football team discuss their game while fans cheer .,5
football players talk during a game .,5
Oklahoma Sooner football players talk on the sideline .,5
two football players in white jerseys and purple pants tackle the player in the red jersey .,0
football players are tackling a red uniformed football player during a football game .,0
football players in purple uniforms try to tackle a player in a red uniform .,0
football players try to tackle a player of the opposite team .,5
smiling dancer dressed in red is on the football field with fans in the stadium bleachers behind her .,0
man tackles another man while playing football .,5
playing football .,0
football player in a red jersey jumping onto a player wearing a white jersey,0
American footballer wearing red is pushing the player in white to the ground .,5
football players bang into each other during a football game .,5
group of football players are playing football .,0
quarterback gets ready to throw the football .,0
quarterback ready to pass the football in the middle of a play .,0
quarterback scans the football field while the offensive line protects him .,5
coach talks to a football player during a timeout .,5
football coach speaks with a player .,0
football player in red and white is talking to a coach .,5
talks with football player , other players and crowd in background .,5
is a football player in a red jersey on the field talking to his coach .,5
coach speaking to a football player while everyone watches .,5
football player from OU talks to the coach about the game .,5
football player is talking to his coach .,5
coaching official and football player are talking in front a crowd and other team members .,0
cheerleaders are sitting at a football game .,5
football player in a red jersey getting his knee looked at by another man,5
man is checking out an injured football player at a game .,0
injured football player is being nursed on the field in the middle of a game .,5
men examine a football players leg .,0
football player is trying to tackle another one .,0
football player tries to tackle a player on the opposing team .,5
football player in red keeps the football away from the player in purple and white .,0
football player in white is defending against the player in red who is running with the ball .,5
University 's Sooners football team playing against a rival .,5
football players are in action on the field,5
football players playing a game while fans watch from the bleachers .,5
American footballers in red are confronted by an opposition player in purple and white whilst being watched by spectators in a stadium .,0
football players attempt to advance the ball against a would be tackler .,5
college football game is in progress .,5
football player runs along the sidelines with a football as a crowd watches .,5
American footballer in a red strip is running down the side of the field with the ball .,5
football player is running with a football trying to score .,0
football player is trying to outrun his opponent .,0
football player from the Sooners is about to be taken down by the opposing team in a game .,5
football player tries tackling another player who has the ball .,5
Sooners football player eluding the tackle of two Huskies defenders .,0
football player is running with the ball as a player of the opposing team grabs his leg,5
Sooner football player carrying the ball is trying to avoid being tackled .,0
horse mascot gives high fives to some football fans .,0
players on the field as a Sooner tries to tackle a player,5
playing football in front of large crowd in stadium,0
football player running after a Wisconsin player during a game .,0
football players are running on the field while a large crowd is watching,0
football players turn as a crowd wearing red watches .,5
crowd is standing and cheering at a football game .,0
crowd of people watching a football game with a player wearing red and cheerleaders also wearing red .,0
football player is grabbing the ankle of another player who is holding the ball .,0
Oklahoma football player is about to score .,5
fans at a football game cheer while the player runs towards the endzone .,5
football player is kicking the ball while the opposing fans watch .,5
football player kicks the ball during a game with a red shirted crowd looking on .,0
male wearing a football uniform kicking a football during a football game .,5
man punting a football as fans from the opposing team watch in the background,5
Sooners play another football team , number 17 goes after the ball .,5
man in a baseball hat and sunglasses watching an event in a crowd .,0
man in sunglasses and a baseball cap stands beside a TV cameraman in stadium full of people .,0
man in the gray shirt has a blue baseball cap on .,5
football player is in action among other players .,5
football player points .,0
African-American football player , wearing jersey number 12 for the University of Oklahoma , throws a football to his left .,5
a football field , there is a played in a red jersey and the crowd is behind him .,0
football players in a stadium,0
American footballer in red is being tackled by three players in white whilst other red players look on .,5
Oklahoma player is tackled playing football,5
player being tackled by group of other players on field .,0
players are tackling a football player carrying the football .,0
football player is being tackled .,0
group of football players running down the field .,0
crowd is watching a football game .,0
football players in red are attempting a play against those in purple , white , and gold .,5
man in red has the football , and the team in white is nearby .,5
Oklahoma Sooners playing football against another team , one of the sooners with the ball in their possession .,5
group of men play a college football game .,5
red team and a white team are playing football .,0
players avoiding a fumble .,0
football player in red is running with the all towards the player in white .,5
football players are wearing red and white , and the crowd is also wearing red and white .,0
football player clutches the ball while running down the field .,0
football player running with the ball .,0
football player running with the ball at a game .,0
football player wearing a gold helmet runs holding a football .,0
American footballer in a white strip is making a run with the ball .,5
bunch of football players , and a crowd .,0
football game .,0
large group of football players about to start a game with a large group watching,0
football teams at the line of scrimmage,0
football teams lined up before the hike .,5
football player passes the football to a teammate as the crowd looks on .,0
quarterback hands off the football to a running back .,5
football players wear purple pants , gold helmets and white jerseys .,0
football players fight to gain possession of the ball .,0
football players make a play , while the other team looks on .,0
football player runs with a ball , chased by the opposing team .,0
football player runs with the ball as others run towards him .,5
player has the football as a crowd in red and white watches,5
American football team in white are attempting to stop the player in red who is running with the ball .,5
teams playing a football game in a packed stadium,0
football player in blue and one in red play in a game .,0
Sooners football player moves quickly on the field as another player runs .,0
two players , on opposite teams , are in the middle of a football game , while others watch .,5
men play football .,0
football player getting tackle,5
football player is tackled .,0
football players in red jerseys taking another in a white jersey to the ground,0
football players from red team tackling one player from white team .,0
football players tackle another player who is holding a ball .,0
red uniformed football player tackles an opposing player .,5
football player is tackling another player .,0
are two football players in red jerseys tackling a man wearing a white jersey,0
football players and two are fighting for the ball .,0
football players are tackling one player of the opposite team .,0
football player in a purple uniform holds the ball while a player in red tries to tackle him .,5
football player in white is being tackled by a Oklahoma University player .,5
American footballer in a red outfit is attacking the player in white who is running with the ball , whilst other players are nearby .,0
Sooners football player is tackling an opposing player .,5
football player in red and white is holding both hands up .,0
players gather around the referees .,0
players gathering to contest something to collaborating officials .,0
University football players in front of a crowd of Sooners fans and next to three referees .,0
red and white football team is talking with the officials .,0
Sooners football player in his red and white uniform being lifted by two teamates dressed the same .,5
players in red and white are jumping and hugging .,0
football players in the red and white team uniforms are jumping up and down .,0
football players wearing red jerseys are on the field .,0
player Quarterback in red Sooners jersey and red helmet prepares to receive snap,0
players huddle and get ready for the game .,0
players stand at the line of scrimmage .,0
Sooner football players on the field .,0
football game in progress .,0
players are on the field .,0
play football as a crowd watches .,5
waiting for snap of football .,0
football teams compete .,0
football player being tackled from behind by another player from a different team in front of a crowd .,0
football player in a Sooners jersey , runs down a field with a large crowd in the background .,5
football player in red being tackled by opponents in white .,0
football player wearing a number 23 white jersey tackles a football player wearing a red , number three jersey while fans cheer .,0
football tackle in progress with a crowd in the background .,5
football player tries diving after another player .,5
pro football player tackles another player on the goal line in a crowded stadium .,5
player in white and purple uniform with legs being tackled by player in red and white uniform .,5
player tackling another player in a football game .,0
red football player is grabbing the purple and white player 's leg to try and stop him .,5
football layer wearing a red shirt .,0
football player facing off against two others .,0
football player for the Sooners stands in front of the oppsing team waiting for the next play .,0
football player in a red uniform is standing in front of other football players in a stadium .,0
football player for the Sooners is preparing for the next play during a game .,0
football player in a Sooners uniform .,0
football player wearing a Sooners uniform with the number 42 .,5
man in a red football uniform prepares to play .,0
football player dressed in red looks down field .,0
football player kicks the ball .,0
Oklahoma football player attempts to kick the ball .,5
player for the Oklahoma Sooners football team punts the ball during a game .,0
University kicker , kicking the football,5
football player in red kicks off the ball .,0
football player holding a football .,0
football player in red gets ready to throw a football .,0
lone football player wearing a red and white jersay holding a football .,0
football player dressed in red and white gets ready to throw the ball .,5
football player gets ready to throw the ball .,0
football coach standing with his players behind him .,0
group of football players in gold helmets stand around a man in a purple shirt .,0
group of footballs players is standing behind a coaching official .,0
man in blue shirt is surrounded by football players .,5
man surrounded by football players .,5
coach in a white polo shirt on a football field,0
football coach is walking on a football field .,0
man in a white shirt is walking on a football field in front of some players .,0
man on the coaching staff for OU has sunglasses on his head during a football game .,5
team manager out on the football field during a game .,0
football team doing excercises,0
football team doing their stretches before the game starts .,5
players are stretching together .,5
football players are working on stretching their legs .,5
four football players in red stretch on the green turf .,5
Americans play football .,5
group of football players in red and white uniforms .,0
large group of football players sitting on a field wearing red and white jerseys .,0
football players sitting on the ground .,5
men in football uniforms sit on the grass , looking unhappy .,0
fan checks his cellphone while watching a football game .,5
man in a red shirt is watching a football game .,0
man in red holds up a cellphone on the sidelines of football game .,5
man in red takes cellphone pictures at a football game .,5
man is wearing a Sooners red football shirt and helmet .,0
Oklahoma Sooners football player wearing his jersey number 28 .,5
Sooners football player weas the number 28 and black armbands .,5
in red and white football uniform,0
American footballer is wearing a red and white strip .,5
football player is in a red and white uniform Sooners # 28 .,5
large football player in a red uniform,0
man in a red football uniform and helmet looks to the left .,0
Oklahoma football player watches the game from the sidelines .,5
football team wears red shirts and red helmets .,0
closeup photo of a football player for the Sooners team who is wearing a red jersey with the number 19 .,0
football player with a red Sooners jersey on .,0
man wearing a red football uniform and gray gloves looks to the left .,5
American footballer is wearing a red and white strip .,5
in playing football in Sooners jersey number 19,5
child in an orange shirt holding a baseball bat watches the ball thrown at him .,5
young boy is getting ready to hit a baseball .,5
young man wearing a yellow shirt and baseball helemt swinging a bat,0
in yellow shirt getting ready to hit orange ball with baseball bat,5
little boy is holding a skinny baseball bat while standing between two rows of blue seats .,0
boy wearing a black shirt and blue jeans is holding a red baseball bat .,0
boy plays baseball .,0
little boy plays baseball with himself .,0
young boy wearing blue is holding a blue baseball bat and holding a white ball in his hand .,0
group of baseball players wearing blue uniforms walk across the grass .,0
men 's baseball team leaving the field,5
team of baseball players in blue uniforms , walking together on field .,5
members of a baseball team walk across the diamond .,5
boy standing on a football field with a colored ball .,0
little boy stands at a football field and prepares to kick a child 's play ball .,5
boy baseball player in a green and yellow jersey leaps for the ball .,5
boy chasing a baseball .,0
little boy playing baseball goes for the ball on the ground .,5
young boy dives to catch the ball during a baseball game .,0
little boy kneels and prepares to throw a basketball .,5
little boy starts to toss a mini basketball .,0
little boy throws a basketball .,0
boy in yellow shorts kicks a soccer ball in a basketball court .,5
little boy in orange shorts and flip-flops plays soccer on a basketball court .,5
boy kicking pink soccer ball on a basketball court .,5
man wearing a baseball uniform swings back with a large bat .,0
baseball player holds up his bat ready to swing .,0
boy in a yellow uniform carrying a football is blocking another boy in a blue uniform .,5
football player in a yellow jersey is pushing away another player .,5
young football player is trying to avoid being tackled .,0
boys playing football on opposing teams .,0
young football players wearing blue and yellow uniforms fight for the ball .,0
player has fallen on the court while another grabs at the ball from out of frame .,0
basketball players are scrambling for the ball on the court .,0
basketball players , one on the floor , struggle to gain possession of a basketball .,5
high school basketball players reach to grab the ball , one falling to the floor .,0
men in uniforms playing basketball , struggle for the ball .,5
boy in an orange jersey is about to pitch a baseball .,0
little boy in orange pitching at a baseball game .,0
young boy in an orange uniform is pitching a baseball during a game .,0
boy gets ready to shoot a basketball .,0
boy is holding a basketball up in front of a white house .,0
boy looking intently , holding a blue basketball , a white house in the background .,5
man is shooting a blue basketball .,0
youn man in front of a white house holding blue and red basketball .,0
boys with wearing baseball caps are sticking out green stained tongues .,0
young boys wearing collared shirts and baseball caps have their blue-tinted tongues stuck out .,0
man in a red baseball cap eats a chip .,0
catcher in a red and white uniform plays at a baseball game .,0
lady with a baseball cap on talking on he cellphone,0
small child swings back a red baseball bat .,5
boy in a red and white shirt kicks a large baseball while surrounded by people .,5
boy kicks a giant baseball while a group of children watch .,5
boy kicks a really large baseball,0
are outside playing with an oversized baseball .,0
baseball hitter holding a bat falling down .,0
baseball player runs on the field .,0
boy at bat playing a baseball game falls to the ground while onlookers watch .,0
baseball player , dressed in red and white uniform and holding a bat , is falling after being hit by a pitch .,0
man with no shirt and wearing sunglasses is holding a football .,5
man with no shirt on is holding a football .,0
shirtless man catches a football,0
shirtless man playing football on a lawn .,5
young topless man wearing sunglasses and shorts is holding a football .,5
men are jumping into the air to catch the football .,0
men play football .,0
guy skateboarding on a basketball court,5
in the water with a basketball and a person on horseback .,0
dogs are playing near water next to a deflated basketball .,0
dogs stand on sand surrounded by water , a deflated basketball and a person on a horse .,0
dog catches a Frisbee at a baseball field during a game .,5
