woman is using Frisbees to play with a dog in front of a stadium crowd and a group of baseball players .,0
and dog do Frisbee tricks as crowd watches in baseball stadium .,0
girl basketball player wearing blue is blocking another girl player wearing yellow .,0
group of people gather on a basketball court as one person jumps for the ball .,5
players jumping up for the ball during a game .,0
are playing basketball .,0
teams of players playing basketball on a court outside .,0
people , one wearing a t-shirt and baseball cap , are seated on a bus .,0
football player in a full stadium jumping and recieving a football .,0
American footballer in yellow catches the ball whilst under pressure from the payer in white .,5
football players playing football before a huge crowd .,0
football players run into each other .,0
men vie for a football .,0
baseball player , a woman with Frisbees , and a dog in front of blue bleachers .,0
woman thows a Frisbee to a dog as a baseball player in uniform runs behind her .,5
girl does freestyle Frisbee tricks with her dog at the baseball park .,0
baseball player is tagged out sliding into second base .,0
baseball player slides toward a base .,0
men playing baseball .,0
children playing basketball .,5
people are playing basketball on a plank deck outdoors .,0
people playing basketball on wooden area near the beach .,5
playing basketball on a wood deck .,0
man holds a baseball hat above his head with a pole .,0
little boy playing baseball outside wearing flip flops .,0
little boy preparing to hit a baseball,0
small boy wearing a red shirt swinging a baseball bat,0
young boy gets ready to swing his baseball bat .,0
football player has the number 25 .,5
football player , his helmet half off , looking at the ground .,0
football player wearing a white uniform walks and looks down .,5
university of Miami football player # 25 .,5
of football player # 25 .,5
football player prepares to throw the ball .,0
guy with a football , a crowd watching him .,0
man wearing a white uniform is playing football .,0
football player is preparing to make a play with onlookers nearby .,5
group of football players huddled together in the middle of the field .,5
group of football players wearing orange and blue uniforms gather together on the field .,5
players in blue and orange uniforms are huddled together and hugging each other .,5
players in uniform embrace one another .,0
football player in a blue and yellow uniform is tackling another player in a white and gold uniform .,0
on a football team scuffle in an attempt to get the ball .,5
football players are tackling an opposing football player with a referee nearby .,5
football players are tackling a third while a referee watches .,5
football players tackle another football player .,0
little boy in a blue jacket hits a baseball .,0
football player in mid stride holding a football .,5
football player is running with a football .,0
football player with a football is being pursued by another player .,0
american footballer in a white strip who is carrying the ball is being pursued by another player in a black strip .,0
football player holding the ball is chased by another football player from the opposing team,0
football player being tackled during a game .,0
football player has his arms wrapped around the person holding the ball .,5
football player in orange being tackled by a player in blue .,0
young boy wearing orange is running with the football as the boy in blue tries to wrestle him to the ground .,5
in orange jersey has the football and is being tackled .,0
football fan showing his devotion by painting his face .,5
person with the face paint and football jersey is sitting in bleachers,5
dog splashing in a small pool with a small football .,5
youth riding a skateboard is airborne amongst the basketball courts .,0
football player carries the ball during a game .,0
football player catches the ball as another tries to tackle him .,5
football player in an orange jersey tries to escape with the ball from the tackler .,5
football player is getting tackled .,5
football player in the orange uniform has the ball in his arms .,0
holder and kicker for a football team dressed in orange , white and black play while onlookers behind them watch .,0
kicker launches the football forward while the holder checks his fingers .,5
football player wearing a white helmet and orange chairs swing his leg while the player next to him kneels .,0
football player are in the kick off position in front of a crowd .,0
young men on the same football team are wearing orange and white uniforms and playing on an outside field while coaches and other players watch .,5
little girl in a football jersy and pink snow hat is standing on a football field .,0
football player wearing an orange jersey and one wearing a white jersey are set at the starting line .,0
college football players about to face off .,5
football players are getting ready to tackle each other,5
football players , one in an orange jersey and one in a white jersey , play on the field .,0
rival football players head to head .,0
playing , basketball ball in air,0
group of boys play basketball outside of a brown building .,5
people stand on a basketball court as a ball flies through the air .,5
teen boys playing basketball outside,0
teens watching a basketball in the air .,0
bunch of football players on top of each other .,5
group of people playing football form a big pile .,0
referee is watching a professional football game in the grass .,5
players in the middle of a play .,0
players making a tackle with the referee in the foreground .,5
football player is running with the ball .,0
football player running with football under his arm .,0
man in a football uniform is running with a football during a game .,0
man in a blue jersey is running holding a football,0
football player in black runs with the football .,0
man in a white jacket and blue baseball cap .,0
group of basketball players wearing yellow and green reach for a ball .,0
players shoot for a goal during a game .,5
men jumping in a basketball game,0
this picture all men from both basketball teams with red and green jerseys are jumping .,0
man on the yellow basketball team tries to score while the men on the opposing team try to block his shot .,0
football player wearing an orange jersey holding a football,0
football player wearing an orange uniform smiling and holding the football .,0
man in an orange jersey with the letter " 12 " on it plays football .,5
University of Miami player holds a football .,0
12 in orange gets ready to throw the football .,0
players wearing orange uniforms are tackling a player in a white uniform,0
tackle in a football game .,0
footballers in a tackle .,0
men are involved in a football game are tackling each other .,5
players take down the player with the ball in a football game,0
football player runs with the ball , chased by members of the opposing team,0
running back running with the football .,0
football players are running on the grassy field .,0
playing football .,0
teams compete in football .,0
football player catching the football .,0
football player in a brown jersey jumping up to catch a football,0
football player jumps up to catch the ball while others run towards him .,5
players playing football .,0
football player jumps into the air to catch a football .,0
football running back getting tackled,5
player tackles a player who has the ball , as a third player watches .,5
football player attempts to get the ball from another football player who is running .,5
American footballer in brown is tackling the player in whit who is running with the ball .,5
is a football game in progress .,0
girl is catching a baseball before an opponent touches base .,0
group of little boys play football in uniforms .,0
in uniforms , pads and halmets play football,0
children , in uniforms of two different teams , are playing football .,5
young boys dressed in uniform play football .,0
boys ' football teams compete on the field .,0
adolescents play football in a residential yard while an older man watches .,0
football game is played .,5
football teams play a game .,0
football teams playing a game,0
football teams play on the field .,0
teams of football players about to start a game .,0
men react as a football flies overhead .,0
men with football in air,0
small black brown and white dog catches a football in midair as a man and child look on .,5
white dog with spot on back leaping in air with football in mouth with small boy and man watching .,0
boy in football gear running with the football,0
child runs with a football .,5
in football uniform running on grass .,0
boy in the red jersey runs with the football .,0
boy is clutching the football and making a run for a touchdown while looking behind him .,0
football player in a gold helmet is running with a football .,0
football player in a purple jersey is running the ball in for a touchdown .,0
football player runs across the field as the referee blows his whistle .,5
football player runs past an official carrying a football .,0
football player runs the ball past the referee .,5
football player folding a football during a game in the mud,5
footballers in yellow outfits are playing in a very muddy field .,0
young football player in a muddy , yellow and blue uniform carrying a football with other muddy players run behind him .,0
players playing in mud .,5
players playing in the mud .,5
baseball player argues with the catcher .,0
pitcher and catcher celebrate striking another baseball player out in a pro game .,0
baseball players near the pitching mound are celebrating as the batsman walks away .,5
professional baseball players during a game , one more in the background .,0
Miami basketball player .,0
orange-clad Miami basketball player dribbles the ball while another man blocks,0
tall black man playing basketball .,0
basketball player is wearing an orange uniform and holding a basketball .,0
men play basketball ,,0
basketball player looks for someone to pass the ball to .,0
man on the Miami basketball team holds the ball getting ready to make a move while being blocked .,5
player holding the ball .,0
basketball player holds the ball and looks across the court .,0
man is wearing an orange uniform and holding a basketball .,0
basketball player in orange has the ball while another in blue tries to block him .,5
basketball player in orange is keeping the ball from a player in blue .,0
basketball player in blue is challenging the player in orange for the ball .,0
basketball player in the blue uniform is guarding the player in the orange uniform , who has the ball .,0
teams compete in a basketball game .,0
basketball player wearing an orange uniform looks backwards .,0
basketball player in the orange jersey is being guarded by the player in the blue jersey .,0
basketball player looks around the court as another player tries to block him .,5
men from opposite teams playing basketball .,0
men play basketball .,0
man in a Miami basketball uniform looking to the right,0
Miami basketball player looks off in the distance .,5
Miami basketball player is looking .,5
baseball player swinging a bat,0
baseball player running toward a base with another waiting on the base,0
two people are in baseball uniforms , making a play at base .,5
men playing baseball with the one in the black and red jersey running toward base .,0
people playing baseball .,0
boy in a baseball cap jumps over a flight of stairs .,5
boy , wearing a baseball cap , jumps in the air near some steps .,0
is a boy wearing jeans and a baseball cap jumping in the air .,0
young boy in a red football jersey makes a large gesture as he stands in the midst of pumpkins .,0
baseball pitcher is bowling the ball .,0
man playing baseball , throwing the ball .,0
guy is in a baseball uniform , in a baseball field , and is throwing a baseball,5
group of men playing against each other in a football match .,0
man catches a football in midair while jumping into a pool .,0
basketball game,0
group of athletes playing a basketball game,0
group of basketball players jump in the air for the ball .,0
players participate in a game .,0
and yellow teams are trying to get the basketball in the goal .,5
fencing class takes place on a basketball court .,0
people are fencing on a basketball court .,0
basketball player in a white uniform is making a jump shot against a team wearing black uniforms .,0
basketball player takes a shot .,0
players leap for the ball while the crowd watches .,5
player in white uniform leaping to make a shot while being blocked by player in black .,5
football players are preparing for the next play .,0
football players in hike formation .,0
football players preparing to hike a football .,0
people wearing blue , red , and white football uniforms crouched over as though in play .,0
players in red white and blue football uniforms squat down on the field .,0
basketball players in action .,5
men playing basketball , two from each team .,0
boys in green and white uniforms play basketball with two boys in blue and white uniforms .,5
men playing basketball in a competition .,0
little girl pounces a punching bag on a football field .,5
girl in a pink shirt tackles the football equipment on the field .,5
large crowd of people wait in line to get into a football game .,0
of dirty men play football .,5
play football .,0
basketball player shooting while another player is trying to block his shot .,5
basketball player tries to block another .,5
basketball players reaching for a ball .,0
men are playing Basketball,5
men jump for the basketball .,0
basketball player defends another player .,0
man with a basketball blocks an attempt to take his ball .,5
runs by other man with basketball at a game .,0
men are playing during a basketball game .,0
bald basketball player is standing on a court with the ball in his right hand .,0
basketball player holding a ball with Miami 5 on his shirt .,0
guy playing basketball .,0
Miami basketball player with basketball in right hand on court .,0
five of the University of Miami men 's basketball team has the ball .,5
basketball player attempts to get the basketball from another player .,5
paced basketball action,5
basketball player wearing the white outfit and orange sneakers is doing a lay up .,0
men are playing basketball,0
basketball player is about to make a lay-up .,5
basketball players , in front of a crowd .,0
and Clemson playing a basketball game , one player about to lay the ball in,0
basketball player in white is jumping up to score a point against the orange team .,5
bunch of football players in blue .,0
football team in blue uniforms run out of a smoke cloud .,0
group of football players wearing blue uniforms run down a foggy field .,0
large group of football players in blue jerseys running through the field .,0
American footballers in blue are doing a victory run towards camera .,0
black man is dunking a basketball while another man jostles him on the court .,0
man in a white jersey is slam dunking a basketball .,0
man with jersey 23 is dunking the ball at a basketball game .,5
person in uniform dunking a basketball .,0
number 23 dunks the basketball into the net with a crowd in the background .,5
basketball player gets ready for the shot .,0
basketball player is looking up and set to throw the ball .,0
men 's basketball player # 33 shooting basketball .,5
basketball player is holding a basketball getting ready to take a shot .,5
Florida basketball player is preparing to shoot the ball .,0
basketball player holds the ball during a game .,0
with a basketball in a Florida uniform .,0
basketball player in white is holding an orange basketball .,0
basketball player is wearing a Florida jersey .,0
boys playing flag football with purple jerseys .,0
children are playing flag football together .,5
children are playing with a football on the grass .,5
little boys playing flag football in purple jerseys .,0
basketball player preparing to shoot the ball,0
basketball player takes a shot .,0
black man playing basketball with orange shoes,0
player with 32 on jersey jumps to make a shot , crowd in background .,5
basketball player shooting,0
basketball,0
basketball player dribbles the ball .,0
Miami basketball player dribbles the ball and looks serious .,0
Miami Hurricanes basketball player has possession of the ball .,0
basketball player in the white strip is dribbling the ball on the court .,5
bald man dribbles a basketball while wearing a Miami jersey .,0
playing basketball , jersey number 5 .,5
five plays basketball for Miami .,0
basketball player is wearing orange sneakers .,0
white dog with black spots is catching a baseball with its mouth .,0
basketball players are grabbing for the ball during a game .,0
basketball player in white holds the ball .,0
basketball players leap to grab a ball .,5
men are playing a game of basketball,0
men are playing basketball .,0
basketball player wearing a red and white jersey while running down the court .,0
dark skinned man in a white sports outfit plays basketball .,0
man dribbles a ball during a basketball game .,0
SMU basketball player playing basketball .,0
SMU basketball player drives to the basket .,0
basketball player leaps with the ball while opponents try to block him .,5
pro basketball player in a white Miami uniform makes a defensive move .,5
players try to block a ball from going into the goal .,5
in a Miami basketball uniform jumping to make a shot .,5
basketball player is number 21 from Miami .,5
basketball player in the air about to make a shot .,5
basketball player jumps up with the ball as two others watch .,5
school basketball game is in progress .,5
player from Eastern goes between two defenders for a shot .,0
playing a basketball game .,0
basketball player in a red uniform is holding the ball while a player in a white uniform is trying to block him .,5
basketball player with a ball and defenders .,0
rival teams are playing basketball .,0
basketball teams playing a game on the court .,0
basketball player dribbles the ball while another blocks him and an official looks on .,0
basketball player in a whit outfit is dribbling the ball around a player in a red outfit as the referee looks on .,0
Miami basketball player dribbles by an Arizona State player .,0
referee watches two basketball players playing basketball .,5
guard drives towards the basket during a college basketball game .,5
basketball player in white leaps up at the net .,0
basketball player is jumping and holding a basketball over the net .,0
basketball player slam dunks the ball .,0
man jumps with a basketball to make a hoop .,5
basketball player is dropping the basketball into the net .,0
basketball player wearing a black and white uniform dribbles the ball .,0
a women 's basketball game , a white skinned woman dribbles against the Chicago defense .,0
players in action .,5
basketball player in white is dribbling the ball towards the player in black .,5
in white dribbling basketball .,0
man contorts his body as he plays baseball .,5
basketball player jumps for a shot while another attempts to block him .,5
in blue and white uniform shooting basketball being blocked by man in white and red .,0
basketball players oppose each other at the net .,0
men are playing basketball and one is trying to block the other .,5
men , one with a ball and a blue uniform , and the other in a white uniform are playing basketball .,0
group of boys are playing basketball and a boy in a brown shirt is throwing a basketball into the basket .,0
man jumps up towards the basketball hoop as others watch .,5
man wearing a brown shirt throwing the basketball into the basket .,0
people play basketball outside .,0
basketball player performing a lay-up .,5
boy in a blue basketball uniform , number 13 and a boy in a white basketball uniform , number 23 jump for the ball .,0
man in a white uniform jumps while holding a basketball as another in blue blocks him .,0
player wearing a white , number 23 jersey jumps up with the ball while guarded by number 13 on the opposite team .,0
man in white is playing basketball against the man in blue .,0
basketball player in white is trying to defend against the player in black who is dribbling the ball .,5
african american runs with a basketball as a caucasion tries to take the ball from him .,0
in black uniform dribbling basketball away from guy in white uniform,0
teams are playing basketball as one man is driving towards the hoop .,5
player attempts to get ball from black player on basketball court .,5
basketball player tries to aim for the goal while being blocked by other players .,0
basketball player with several blockers .,0
group of high school basketball players play a game .,5
group of basketball players trying to get the ball from another player .,0
young man in a white uniform holds a basketball surrounded by members of the opposing team wearing green .,5
basketball player in blue is attempting to block a player in white during a game .,5
men are playing basketball .,0
basketball players play in a game .,0
black men playing basketball in a gym .,0
men from opposite teams play basketball together .,5
basketball player jumps to make the shot while another tries to stop him .,5
in blue sport uniform with basketball in right hand attempting to score basket while being blocked by player in white uniform .,0
basketball player in white is defending the basket against the player wearing blue .,0
basketball players oppose each other at the net .,0
men are playing basketball and one is trying to block the others shot .,5
basketball player in a blue jersey holds the ball high .,0
basketball player is getting ready to shoot a hoop,5
man in blue uniform about to throw a basketball .,0
man wearing a blue basketball jersey is shooting the basketball .,0
basketball player concentrating on keeping the ball from other players .,0
basketball player holding a basketball .,0
basketball player in blue is running between two players in white .,0
man in blue has the basketball while the man on the left watches and the man on the right tries to stop him .,0
basketball teams compete .,0
basketball player dribbles .,0
basketball player for North Carolina moves with the ball in hand .,0
man in a blue jersey plays basketball .,0
North Carolina basketball player dribbles the ball .,0
basketball player holds the ball .,0
basketball player in red is challenging the player in white for the ball .,0
teenagers are fighting over a basketball during a game .,0
basketball players fighting over control of a ball .,0
basketball players struggle for the ball .,5
males , one in red and one in white playing a basketball game .,0
boy leans on a baseball bat and holds out one arm outstreached .,0
young boy poses in a field with a baseball bat .,0
young boy with a baseball bat holing his arm out .,5
boy is wearing a green cap and holding a black baseball bat .,0
baseball players are on the field while a large crowd is watching,0
boy wearing a shirt with an American flag plays with a basketball on the blacktop .,5
boy with a basketball .,0
young boy playing basketball .,0
with american flag shirt bounces basketball .,5
basketball player from one team making a rebound while three players oppose him .,0
basketball player in orange has the ball while three others in blue and white defend .,5
player in orange trying to score through three men from the opposing team .,0
men are playing in a basketball game .,0
basketball players in white are defending against the attacking player with the ball in orange .,5
little girl plays on a toy basketball game .,5
holding a beer throws a basketball where a little girl is playing .,0
baby in the red outfit is sitting in the middle of a basketball arcade game .,5
is a man shooting basketballs next to a toddler .,0
basketball player in black jumps , while another in white attempts to block .,5
boy wearing a black jersey holding a basketball while another is behind him trying to get the ball,0
basketball players fighting over the ball .,0
male basketball players are fighting over a basketball .,0
young men play basketball while crowd looks on,0
basketball player aims for the goal .,5
basketball player gets ready to shoot .,0
basketball player has jumped in the air to shoot the basketball .,5
basketball player in white jumping to throw the ball , audience in the back .,5
is a college basketball player shooting a jumped .,5
woman in a white baseball hat reveals her tan line to her friend , who wears a sun hat,0
baseball player in a blue uniform has just released the baseball on the sidelines .,0
baseball player is following through with an action nearby a teammate .,5
baseball player strains to throw a ball .,5
yougn boy in a blue and white baseball uniform throwing a baseball while tucking his glove close to his body .,5
baseball player wearing blue is throwing the ball .,0
play football .,0
baseball player swings at a baseball .,0
in blue and white uniforms are on the field playing baseball .,0
crouches behind baseball hitter .,0
basketball player for Miami U. pushes forward .,5
basketball player runs while another tries to block him .,5
basketball player runs while dribbling the ball .,0
blows whistle as basketball player attempts to block another with the ball .,5
guy in the white uniform has a basketball in his hand .,0
basketball player dribbles the ball during a game .,0
basketball player wearing a white uniform is dribbling the ball on the court .,0
man wearing a white uniform dribbles the basketball during a game .,0
professional basketball player dribbles the ball around the opposing player .,0
player pushes away opponent,0
basketball player attempting to control the ball near the basket rim .,5
basketball player in a red uniform is trying to make a basket but is being blocked by the opposing team .,5
basketball player is scoring a basket .,0
men jump up for the ball near the hoop in a basketball game .,0
